Local time: +3:00 UTC
ProcessId: 18724
(12040) 08:09:12.893  d: System runned under native Windows
(12040) 08:09:12.893  m: Starting in normal mode
(12040) 08:09:12.893  m: Executing "default.cfg"
(12040) 08:09:12.894  m: setvar app_always_active = "0"
(12040) 08:09:12.894  m: setvar bloomEnable = "1"
(12040) 08:09:12.894  m: setvar gfx_fullscreen = "1"
(12040) 08:09:12.895  m: setvar gfx_refreshrate = "0"
(12040) 08:09:12.895  d: Could not parse screen resolution settings, using defaults
(12040) 08:09:12.897  m: setvar gfx_resolution = "1920x1080"
(12040) 08:09:12.897  m: setvar gfx_vsync = "1"
(12040) 08:09:12.897  m: setvar grass_fade_distance = "100"
(12040) 08:09:12.897  m: setvar language = "ru-RU"
(12040) 08:09:12.897  m: setvar pfx_enable = "1"
(12040) 08:09:12.897  m: setvar pfx_sharp_enable = "1"
(12040) 08:09:12.897  m: setvar shadows = "1"
(12040) 08:09:12.897  m: setvar shadow_terrain = "1"
(12040) 08:09:12.897  m: setvar shadowPCF4_enable = "1"
(12040) 08:09:12.897  m: setvar waterrefl = "1"
(12040) 08:09:12.898  m: Executing "user.cfg"
(12040) 08:09:12.898  m: setvar app_always_active = "0"
(12040) 08:09:12.898  m: setvar bloomEnable = "1"
(12040) 08:09:12.898  m: setvar camera_link_to_hero = "-1"
(12040) 08:09:12.898  E: setvar error: camera_pitch value '-0' cannot be verified
(12040) 08:09:12.898  E: setvar error: camera_rod value '0' cannot be verified
(12040) 08:09:12.898  m: setvar casual_control_style = "1"
(12040) 08:09:12.898  m: setvar common_graphics_quality = "1"
(12040) 08:09:12.898  m: setvar common_volume = "1"
(12040) 08:09:12.898  m: setvar console_limit = "100"
(12040) 08:09:12.898  m: setvar console_opacity = "0.4"
(12040) 08:09:12.898  m: setvar console_peep = "0"
(12040) 08:09:12.899  m: setvar console_size = "0.5"
(12040) 08:09:12.899  m: setvar console_sweep_time = "0.25"
(12040) 08:09:12.899  m: setvar current_pet = "-1"
(12040) 08:09:12.899  m: setvar enableRESZ = "0"
(12040) 08:09:12.899  m: setvar enable_cursor_clip = "1"
(12040) 08:09:12.899  m: setvar enable_replay = "1"
(12040) 08:09:12.899  m: setvar gfx_fullscreen = "1"
(12040) 08:09:12.899  m: setvar gfx_refreshrate = "0"
(12040) 08:09:12.899  m: setvar gfx_resolution = "1920x1080"
(12040) 08:09:12.899  m: setvar gfx_scale3D = "1"
(12040) 08:09:12.899  m: setvar gfx_skip_mip_levels = "0"
(12040) 08:09:12.899  m: setvar gfx_vsync = "1"
(12040) 08:09:12.899  m: setvar grass_fade_distance = "100"
(12040) 08:09:12.899  m: setvar grass_fade_length = "100"
(12040) 08:09:12.899  m: setvar last_map = ""
(12040) 08:09:12.899  m: setvar lock_actionbar = "0"
(12040) 08:09:12.899  m: setvar lock_camera = "0"
(12040) 08:09:12.899  m: setvar minimap_rotate = "0"
(12040) 08:09:12.899  m: setvar music_volume = "0"
(12040) 08:09:12.899  m: setvar pfx_enable = "1"
(12040) 08:09:12.899  m: setvar pfx_read_enable = "1"
(12040) 08:09:12.899  m: setvar pfx_sharp_enable = "1"
(12040) 08:09:12.899  m: setvar register_replay_extention = "1"
(12040) 08:09:12.899  m: setvar rndr_disableTriLinear = "0"
(12040) 08:09:12.899  m: setvar screenshot_ext = "jpg"
(12040) 08:09:12.899  m: setvar session_camera = ""
(12040) 08:09:12.899  m: setvar session_chat_off = "0"
(12040) 08:09:12.899  m: setvar shadowMapScale = "0.625"
(12040) 08:09:12.899  m: setvar shadowPCF4_enable = "1"
(12040) 08:09:12.899  m: setvar shadowTest = "1"
(12040) 08:09:12.899  m: setvar shadow_terrain = "1"
(12040) 08:09:12.899  m: setvar shadows = "1"
(12040) 08:09:12.899  m: setvar sound_background_enable = "0"
(12040) 08:09:12.899  m: setvar sound_volume = "0.030303"
(12040) 08:09:12.899  m: setvar use_badwords_filter = "0"
(12040) 08:09:12.899  m: setvar voice_volume = "0"
(12040) 08:09:12.899  m: setvar waterReflCoeff = "0.5"
(12040) 08:09:12.899  m: setvar waterrefl = "1"
(12040) 08:09:12.900  m: setvar window_pos_x = "963"
(12040) 08:09:12.900  m: setvar window_pos_y = "554"
(12040) 08:09:12.900  m: Executing "lang.cfg"
(12040) 08:09:12.900  m: setvar language = "ru-RU"
(12040) 08:09:12.901  m: Executing "social.cfg"
(12040) 08:09:12.901  m: setvar social_login_address = "http://ru.pwcastle.nivalnetwork.com:88/"
(12040) 08:09:12.901  d: Fullscreen: 1
(12040) 08:09:12.924  d: Connection with lobby established
(12040) 08:09:12.926  d: ComPtr: GetAddr
(12040) 08:09:12.940  d: ComPtr: GetAddr
(12040) 08:09:12.940  d: ComPtr: Assign 15bfc24 INC
(12040) 08:09:12.943  d: ComPtr: Assign 15bfc24 INC
(12040) 08:09:12.943  d: ComPtr: Free 15bfc24 DEC
(12040) 08:09:12.943  d: ComPtr: Free 15bfc24 DEC
(12040) 08:09:12.944  d: ComPtr: GetAddr
(12040) 08:09:12.948  d: ComPtr: Assign 15be5d4 INC
(12040) 08:09:12.950  d: ComPtr: Assign 15bfc24 INC
(12040) 08:09:12.950  d: ComPtr: Assign 15be5d4 INC
(12040) 08:09:12.950  d: ComPtr: Free 15bfc24 DEC
(12040) 08:09:12.950  d: ComPtr: Free 15be5d4 DEC
(12040) 08:09:12.950  d: ComPtr: Free 15be5d4 DEC
(12040) 08:09:12.988  d: Pile file 'D:\Games\Prime World\PvP\Packs\data06.pile' found
(12040) 08:09:12.995  d: Pile file 'D:\Games\Prime World\PvP\Packs\data05.pile' found
(12040) 08:09:12.998  d: Pile file 'D:\Games\Prime World\PvP\Packs\data04.pile' found
(12040) 08:09:13.001  d: Pile file 'D:\Games\Prime World\PvP\Packs\data03.pile' found
(12040) 08:09:13.004  d: Pile file 'D:\Games\Prime World\PvP\Packs\data02.pile' found
(12040) 08:09:13.009  d: Pile file 'D:\Games\Prime World\PvP\Packs\data01.pile' found
(12040) 08:09:13.026  d: Pile file 'D:\Games\Prime World\PvP\Packs\_data.pile' found
(12040) 08:09:13.027  d: Pile file 'D:\Games\Prime World\PvP\Data\Localization\ru-RU\localisation_files.pile' found
(12040) 08:09:13.117  m: Executing "game.cfg"
(12040) 08:09:13.118  m: setvar stat_client_url = "http://gs.playpw.com/gstat0/"
(12040) 08:09:13.118  m: Value 'use_smooth_turns' is not registered
(12040) 08:09:13.118  m: setvar use_smooth_turns = "1"
(12040) 08:09:13.118  m: setvar rdp_log_events = "3079"
(12040) 08:09:13.118  m: Executing "input.cfg"
(12040) 08:09:13.120  m: Unknown command or variable "parentWidth"
(12040) 08:09:13.120  m: Type 'help' to list available commands
(12040) 08:09:13.121  m: Executing "input.cfg"
(12040) 08:09:13.169  m: Executing "smart_chat.cfg"
(12040) 08:09:13.366  m: UDP transport login address: 92.242.35.3:35006@10
(12040) 08:09:13.367  d: Previous SO_SNDBUF=65536
(12040) 08:09:13.367  d: New SO_SNDBUF=65536
(12040) 08:09:13.367  d: Previous SO_RCVBUF=65536
(12040) 08:09:13.367  d: New SO_RCVBUF=65536
(12040) 08:09:13.367  m: Socket opened. addr=34990, sock=1496
(12040) 08:09:13.367  m: Starting outgoing connection. local=34990, remote=92.242.35.3:35006, mux=10
(12040) 08:09:13.367  m: Cannot read configuration file "D:\Games\Prime World\PvP\Profiles\autoexec.cfg"
(10548) 08:09:13.369  m: Sending INIT. descr=(92.242.35.3:35006 56437:10), seq=4823
(7648) 08:09:13.373  m: UDP socket perfomance debug. addr=34990, recv=1, recv_tm=0.02, deliver_tm=0.00, send=1, send_tm=0.00
(10548) 08:09:13.375  m: ACK sent. descr=(92.242.35.3:35006 56437:10), seq=4823, stage=Active_WaitingInitAck
(10548) 08:09:13.375  m: Active connection handshake completed. descr=(92.242.35.3:35006 56437:10), seq=4823
(10548) 08:09:13.399  m: LoginClient: Got login reply. code=Success(5), uid=5599879, welcome=ru1/lobby/2
(12040) 08:09:13.674  d: OnDeviceChanged
(12040) 08:09:13.674  d: NotifyDeviceCreate
(12040) 08:09:13.692  d: DepthFormat: INTZ
(12040) 08:09:13.696  m: setvar mipmaplodbias = "0"
(12040) 08:09:14.144  d: FMOD Init OK
(16492) 08:09:14.150  m: Recieving permitted event data
(16492) 08:09:14.150  m: Initializing CURLlib...
(16492) 08:09:14.150  m: Performing HTTP GET: url_len=28, url='http://gs.playpw.com/gstat0/'
(16492) 08:09:14.262  d: HTTP GET performed
(16492) 08:09:14.262  m: Recieved permitted event data. size=52
(16492) 08:09:14.262  m: Got permitted events data. size=52
(16492) 08:09:14.262  m: Got permitted events. methods=5, sessionEvents=6
(12040) 08:09:14.302  d: Movie::SetViewport (w,h) = (1281, 1025)
(12040) 08:09:14.640  d: Failed to open file  with error 3.
(12040) 08:09:14.640  d: Cannot load ttf font: DejaVu LGC Sans
(12040) 08:09:14.688  d: Failed to open file  with error 3.
(12040) 08:09:14.688  d: Cannot load ttf font: _sans
(12040) 08:09:14.711  d: Window FlashScreen got focus
(12040) 08:09:14.712  d: Movie::SetViewport (w,h) = (1281, 1025)
(12040) 08:09:14.714  d: Movie::SetViewport (w,h) = (1821, 1025)
(12040) 08:09:14.717  d: Pref value too low. Please, check config variable 'prefs_common_graphics_quality'
(12040) 08:09:14.717  d: Pref value too low. Please, check config variable 'prefs_common_graphics_quality'
(12040) 08:09:14.847  d: Movie::SetViewport (w,h) = (1821, 1025)
(12040) 08:09:14.856  m: Virtual Memory Usage: 256 mb
(12040) 08:09:14.916  d: Command send: StartRender

(12040) 08:09:14.917  d: Collected 0 persistent events
(12040) 08:09:14.917  m: Connecting to lobby server...
(12040) 08:09:14.917  m: Lobby service path: 'ru1/lobby/2'
(12040) 08:09:14.917  m: Lobby service node id: 'lobby/2'
(12040) 08:09:14.937  m: LoginClient: Creating outgoing service channel. svcid=lobby/2, req_id=1
(12040) 08:09:14.938  d: GateKeeper: Generated pipeid(s= t=lobby/2 c=5599879 p=lobby/2)
(12040) 08:09:14.938  m: GateKeeper: Pipe created for service. name=lobby/2
(12040) 08:09:14.938  m: Node requested successfully(svcid=lobby/2)
(12040) 08:09:14.938  m: Query rpc interface(svcid=lobby/2 iface=lobby:entrance)
(10548) 08:09:14.959  m: LoginClient: Got svc reqest reply. svcid=lobby/2, req_id=1, code=0, addr=92.242.35.2:35011@100
(10548) 08:09:14.959  m: ClientChannel: Connection details arrived. code=Ok(0), svcid=lobby/2, req_id=1, addr=92.242.35.2:35011@100
(10548) 08:09:14.959  m: ClientChannel: Connecting to sevice. svcid=lobby/2, addr=92.242.35.2:35011, mux=100, req_id=1
(10548) 08:09:14.959  m: Starting outgoing connection. local=34990, remote=92.242.35.2:35011, mux=100
(10548) 08:09:14.959  m: Sending INIT. descr=(92.242.35.2:35011 52465:100), seq=18111
(10548) 08:09:14.965  m: ACK sent. descr=(92.242.35.2:35011 52465:100), seq=18111, stage=Active_WaitingInitAck
(10548) 08:09:14.965  m: Active connection handshake completed. descr=(92.242.35.2:35011 52465:100), seq=18111
(10548) 08:09:14.965  m: ClientChannel: Connection established. svcid=lobby/2, req_id=1
(10548) 08:09:14.965  m: RdpChannel: Channel connection established. src=, tgt=lobby/2, uid=5599879, remote=0.0.0.0:0
(10548) 08:09:14.971  m: ClientChannel: Got service ack. svcid=lobby/2, req_id=1, code=Ok(0), state=2
(10548) 08:09:14.971  m: RdpChannel: Delayed active channel established. src=, tgt=lobby/2, uid=5599879, remote=0.0.0.0:0
(12040) 08:09:14.986  m: Iface received. svcid=lobby/2, iface=lobby:entrance
(12040) 08:09:14.986  m: Entered lobby, requesting instance...
(12040) 08:09:15.004  m: Got lobby instance
(12040) 08:09:15.583  m: Joining social game...
(12040) 08:09:15.602  m: Starting game session. map='Maps/Multiplayer/MOBA/_.ADMPDSCR.xdb', players=10, gameid=5bbd92db00032099, custom=false, gs_svcid=gamesvc/76, gs_instid=gsi000005d4f96484ef
(12040) 08:09:15.602  m:   Player info. uid=1463714, sex=1, nick=[???]amexs, type=1, team=0, hero=witch, bot_skin=
(12040) 08:09:15.602  m:   Player info. uid=5511618, sex=1, nick=[Bang]?????????, type=1, team=0, hero=wraithking, bot_skin=
(12040) 08:09:15.602  m:   Player info. uid=5602877, sex=1, nick=[Kraft]-????-, type=1, team=0, hero=rifleman, bot_skin=
(12040) 08:09:15.602  m:   Player info. uid=5175116, sex=1, nick=?????????1, type=1, team=0, hero=archeress, bot_skin=
(12040) 08:09:15.602  m:   Player info. uid=1012435, sex=2, nick=[ELDOR]_FucK_OFF_, type=1, team=0, hero=night, bot_skin=
(12040) 08:09:15.602  m:   Player info. uid=3282055, sex=1, nick=[RoAs]Gremlinnns, type=1, team=1, hero=ent, bot_skin=
(12040) 08:09:15.602  m:   Player info. uid=5325733, sex=1, nick=[jvc]neveron1000, type=1, team=1, hero=dryad, bot_skin=
(12040) 08:09:15.602  m:   Player info. uid=3660245, sex=1, nick=[HardS]ognerin, type=1, team=1, hero=hunter, bot_skin=
(12040) 08:09:15.602  m:   Player info. uid=5169796, sex=1, nick=[N_H]????_?????, type=1, team=1, hero=freeze, bot_skin=
(12040) 08:09:15.602  m:   Player info. uid=5599879, sex=1, nick=[minus]???? ???????????, type=1, team=1, hero=wraithking, bot_skin=
(12040) 08:09:15.602  m: Connecting to game server. svcid=gamesvc/76, instid=gsi000005d4f96484ef
(12040) 08:09:15.602  m: Got lobby operation result: Ok(0)
(12040) 08:09:15.602  m: LoginClient: Creating outgoing service channel. svcid=gamesvc/76, req_id=2
(12040) 08:09:15.602  d: GateKeeper: Generated pipeid(s= t=gamesvc/76 c=5599879 p=gamesvc/76)
(12040) 08:09:15.602  m: GateKeeper: Pipe created for service. name=gamesvc/76
(12040) 08:09:15.602  m: Node requested successfully(svcid=gamesvc/76)
(12040) 08:09:15.602  m: Query rpc interface(svcid=gamesvc/76 iface=gsi000005d4f96484ef)
(10548) 08:09:15.619  m: LoginClient: Got svc reqest reply. svcid=gamesvc/76, req_id=2, code=0, addr=92.242.35.6:35017@100
(10548) 08:09:15.619  m: ClientChannel: Connection details arrived. code=Ok(0), svcid=gamesvc/76, req_id=2, addr=92.242.35.6:35017@100
(10548) 08:09:15.619  m: ClientChannel: Connecting to sevice. svcid=gamesvc/76, addr=92.242.35.6:35017, mux=100, req_id=2
(10548) 08:09:15.619  m: Starting outgoing connection. local=34990, remote=92.242.35.6:35017, mux=100
(10548) 08:09:15.619  m: Sending INIT. descr=(92.242.35.6:35017 53493:100), seq=2845
(10548) 08:09:15.625  m: ACK sent. descr=(92.242.35.6:35017 53493:100), seq=2845, stage=Active_WaitingInitAck
(10548) 08:09:15.625  m: Active connection handshake completed. descr=(92.242.35.6:35017 53493:100), seq=2845
(10548) 08:09:15.625  m: ClientChannel: Connection established. svcid=gamesvc/76, req_id=2
(10548) 08:09:15.625  m: RdpChannel: Channel connection established. src=, tgt=gamesvc/76, uid=5599879, remote=0.0.0.0:0
(10548) 08:09:15.631  m: ClientChannel: Got service ack. svcid=gamesvc/76, req_id=2, code=Ok(0), state=2
(10548) 08:09:15.631  m: RdpChannel: Delayed active channel established. src=, tgt=gamesvc/76, uid=5599879, remote=0.0.0.0:0
(12040) 08:09:15.654  m: Iface received. svcid=gamesvc/76, iface=gsi000005d4f96484ef
(12040) 08:09:15.654  m: Connected to game service
(12040) 08:09:15.655  m: Adding client to game server...
(12040) 08:09:15.655  d: Client 5599879 : GameClient created
(12040) 08:09:15.655  d: [ResourceCollection] collect talents
(12040) 08:09:16.493  d: [ResourceCollection] collect consumables
(12040) 08:09:16.527  d: [ResourceCollection] collect marketingItems
(12040) 08:09:16.547  m: Reading "C:\Users\Terem\Documents\My Games\Prime World\0000000000557287.ignore"
(12040) 08:09:16.781  d: Loaded info for map 'Maps/Multiplayer/MOBA/_.ADMP.xdb', max players per team: 5 / 5
(12040) 08:09:16.788  m: ServerNode: Starting game (sid=5bbd92db00032099)
(12040) 08:09:16.788  m: gameclient: Player info. uid=1463714, castle_lvl=40, hero_lvl=25, prating=1617.73, hrating=1439.44, party_id=0
(12040) 08:09:16.788  m: gameclient: Player info. uid=5511618, castle_lvl=34, hero_lvl=1, prating=1872.80, hrating=1471.19, party_id=0
(12040) 08:09:16.788  m: gameclient: Player info. uid=5602877, castle_lvl=26, hero_lvl=20, prating=1456.62, hrating=1426.62, party_id=0
(12040) 08:09:16.788  m: gameclient: Player info. uid=5175116, castle_lvl=40, hero_lvl=25, prating=1664.05, hrating=1400.91, party_id=0
(12040) 08:09:16.788  m: gameclient: Player info. uid=1012435, castle_lvl=38, hero_lvl=18, prating=1643.00, hrating=1494.63, party_id=0
(12040) 08:09:16.788  m: gameclient: Player info. uid=3282055, castle_lvl=40, hero_lvl=16, prating=1614.06, hrating=1406.79, party_id=0
(12040) 08:09:16.788  m: gameclient: Player info. uid=5325733, castle_lvl=40, hero_lvl=5, prating=1774.07, hrating=1456.24, party_id=0
(12040) 08:09:16.788  m: gameclient: Player info. uid=3660245, castle_lvl=40, hero_lvl=12, prating=1510.36, hrating=1435.00, party_id=0
(12040) 08:09:16.788  m: gameclient: Player info. uid=5169796, castle_lvl=29, hero_lvl=15, prating=1355.69, hrating=1344.69, party_id=9
(12040) 08:09:16.788  m: gameclient: Player info. uid=5599879, castle_lvl=38, hero_lvl=9, prating=1515.64, hrating=1460.64, party_id=9
(12040) 08:09:16.789  d: Starting game for 10 players on map 'Maps/Multiplayer/MOBA/_.ADMPDSCR.xdb' (client)...
(12040) 08:09:16.965  d:  TRACE FROM FLASH true 
(12040) 08:09:16.973  d:  AddUser: 2512347849 witch
(12040) 08:09:17.009  d:  AddUser: 2438854131 wraithking
(12040) 08:09:17.016  d:  AddUser: 491463637 ent
(12040) 08:09:17.026  d:  AddUser: 2366472002 rifleman
(12040) 08:09:17.029  d:  AddUser: 242966457 archeress
(12040) 08:09:17.039  d:  AddUser: 299503511 night
(12040) 08:09:17.067  d:  AddUser: 113238783 dryad
(12040) 08:09:17.071  d:  AddUser: 1255640165 hunter
(12040) 08:09:17.079  d:  AddUser: 1183970330 freeze
(12040) 08:09:17.082  d:  AddUser: 2438854131 wraithking
(12040) 08:09:18.090  d: MemoryPool: megapool; allocated size: 20971520; payload: 20889600
(12040) 08:09:18.090  d: MemoryPool: megapool; new allocated size: 31457280
(12040) 08:09:18.795  d: MemoryPool: megapool; allocated size: 31457280; payload: 31252992
(12040) 08:09:18.795  d: MemoryPool: megapool; new allocated size: 41943040
(12040) 08:09:19.712  d: MemoryPool: megapool; allocated size: 41943040; payload: 41936384
(12040) 08:09:19.712  d: MemoryPool: megapool; new allocated size: 52428800
(12040) 08:09:20.439  d: MemoryPool: megapool; allocated size: 52428800; payload: 52427776
(12040) 08:09:20.439  d: MemoryPool: megapool; new allocated size: 62914560
(12040) 08:09:21.063  d: MemoryPool: megapool; allocated size: 62914560; payload: 62872064
(12040) 08:09:21.063  d: MemoryPool: megapool; new allocated size: 73400320
(12040) 08:09:21.688  d: MemoryPool: megapool; allocated size: 73400320; payload: 73320448
(12040) 08:09:21.688  d: MemoryPool: megapool; new allocated size: 83886080
(12040) 08:09:22.253  d: Player behaviour tracking is enabled for this game
(3180) 08:09:22.256  d: P: start
(12040) 08:09:22.260  d: complaintsToday 0 complaintsMax 2 playerId 0 userID 1463714
(12040) 08:09:22.260  d: complaintsToday 0 complaintsMax 2 playerId 1 userID 5511618
(12040) 08:09:22.261  d: complaintsToday 0 complaintsMax 2 playerId 2 userID 3282055
(12040) 08:09:22.261  d: complaintsToday 0 complaintsMax 2 playerId 3 userID 5602877
(12040) 08:09:22.261  d: complaintsToday 0 complaintsMax 2 playerId 4 userID 5175116
(12040) 08:09:22.261  d: complaintsToday 0 complaintsMax 2 playerId 5 userID 1012435
(12040) 08:09:22.261  d: complaintsToday 0 complaintsMax 2 playerId 6 userID 5325733
(12040) 08:09:22.261  d: complaintsToday 0 complaintsMax 2 playerId 7 userID 3660245
(12040) 08:09:22.261  d: complaintsToday 0 complaintsMax 2 playerId 8 userID 5169796
(12040) 08:09:22.261  d: complaintsToday 0 complaintsMax 2 playerId 9 userID 5599879
(12040) 08:09:22.261  d: Player [кру]amexs with hero Чертовка team 0
(12040) 08:09:22.261  d: Player [Bang]Хентайный with hero Павший владыка team 0
(12040) 08:09:22.261  d: Player [RoAs]Gremlinnns with hero Дуболом team 1
(12040) 08:09:22.261  d: Player [Kraft]-ГОСТ- with hero Путник team 0
(12040) 08:09:22.261  d: Player БушьБорщь1 with hero Лучница team 0
(12040) 08:09:22.261  d: Player [ELDOR]_FucK_OFF_ with hero Мартовская кошка team 0
(12040) 08:09:22.261  d: Player [jvc]neveron1000 with hero Дриада team 1
(12040) 08:09:22.261  d: Player [HardS]ognerin with hero Охотник team 1
(12040) 08:09:22.261  d: Player [N_H]Баба_Клава with hero Фриз team 1
(12040) 08:09:22.261  d: Player [minus]Вера Заморочкина with hero Павший владыка team 1 (local)
(12040) 08:09:22.261  d: GameClient.StartingGame
(12040) 08:09:22.383  d: Movie::SetViewport (w,h) = (1281, 1027)
(12040) 08:09:22.513  d: Overriding font 2314 name 'DejaVu LGC Sans' with 'DejaVu LGC Sans Bold'
(12040) 08:09:23.208  d: Failed to open file  with error 3.
(12040) 08:09:23.208  d: Cannot load ttf font: DejaVu LGC Sans Bold
(12040) 08:09:23.518  d: Window FlashScreen losing focus
(12040) 08:09:23.518  d: Window FlashScreen got focus
(12040) 08:09:23.519  d: Movie::SetViewport (w,h) = (1281, 1027)
(12040) 08:09:23.529  d: Movie::SetViewport (w,h) = (1821, 1027)
(12040) 08:09:23.553  d: SmartChat: ready
(12040) 08:09:23.566  d: GameClient.LoadingMap
(12040) 08:09:23.584  m: LoginClient: Creating outgoing service channel. svcid=chat, req_id=3
(12040) 08:09:23.584  d: GateKeeper: Generated pipeid(s= t=chat c=5599879 p=chat)
(12040) 08:09:23.584  m: GateKeeper: Pipe created for service. name=chat
(12040) 08:09:23.584  m: Node requested successfully(svcid=chat)
(12040) 08:09:23.584  m: Query rpc interface(svcid=chat iface=chat.client.iface)
(10548) 08:09:23.610  m: LoginClient: Got svc reqest reply. svcid=chat, req_id=3, code=0, addr=92.242.35.3:35010@100
(10548) 08:09:23.610  m: ClientChannel: Connection details arrived. code=Ok(0), svcid=chat, req_id=3, addr=92.242.35.3:35010@100
(10548) 08:09:23.610  m: ClientChannel: Connecting to sevice. svcid=chat, addr=92.242.35.3:35010, mux=100, req_id=3
(10548) 08:09:23.610  m: Starting outgoing connection. local=34990, remote=92.242.35.3:35010, mux=100
(10548) 08:09:23.610  m: Sending INIT. descr=(92.242.35.3:35010 53786:100), seq=7481
(10548) 08:09:23.616  m: ACK sent. descr=(92.242.35.3:35010 53786:100), seq=7481, stage=Active_WaitingInitAck
(10548) 08:09:23.616  m: Active connection handshake completed. descr=(92.242.35.3:35010 53786:100), seq=7481
(10548) 08:09:23.616  m: ClientChannel: Connection established. svcid=chat, req_id=3
(10548) 08:09:23.616  m: RdpChannel: Channel connection established. src=, tgt=chat, uid=5599879, remote=0.0.0.0:0
(10548) 08:09:23.622  m: ClientChannel: Got service ack. svcid=chat, req_id=3, code=Ok(0), state=2
(10548) 08:09:23.622  m: RdpChannel: Delayed active channel established. src=, tgt=chat, uid=5599879, remote=0.0.0.0:0
(12040) 08:09:23.688  m: Chat client iface OPENED
(12040) 08:09:23.688  m: Iface received. svcid=chat, iface=chat.client.iface
(12040) 08:09:23.750  m: gamechat::Client::OnRegisterUser(sidL=161280 chatUserid=1457206 rc=0)
(12040) 08:09:23.750  m: gamechat::Client::OnJoinChannel(sid=161280 chnlname=Session)
(12040) 08:09:23.750  m: gamechat::Client::OnJoinChannel: channel registered successfully(sid=161280 chnlname=Session chnltype=2)
(12040) 08:09:23.750  m: gamechat::Client::OnJoinChannel(sid=161280 chnlname=Right)
(12040) 08:09:23.750  m: gamechat::Client::OnJoinChannel: channel registered successfully(sid=161280 chnlname=Right chnltype=1)
(12040) 08:09:23.750  m: gamechat::Client::OnJoinChannel(sid=161280 chnlname=Right_SmartChat)
(12040) 08:09:23.750  m: gamechat::Client::OnJoinChannel: channel registered successfully(sid=161280 chnlname=Right_SmartChat chnltype=3)
(12040) 08:09:23.750  m: gamechat::Client::OnRegisterUserReturn(rc=0 userid=5599879 rpcsts=1)
(6548) 08:09:23.819  m: Loading baked geometry from file: /Maps/Multiplayer/MOBA/_.baked_terrain
(6548) 08:09:24.552  d: WarFogUnblock: 0.000
(6548) 08:09:25.658  d: MemoryPool: megapool; allocated size: 83886080; payload: 83831808
(6548) 08:09:25.658  d: MemoryPool: megapool; new allocated size: 94371840
(12040) 08:09:25.668  m: Frame time histo: {0; [0.0, 2.0]: 2; [2.0, 10.0]: 0; [10.0, 20.0]: 35; [20.0, 30.0]: 0; [30.0, 40.0]: 0; [40.0, 50.0]: 0; 0}
(6548) 08:09:25.782  d: SimpleObject: 1.230
(6548) 08:09:25.782  d: GameObject: 0.000
(6548) 08:09:25.926  d: Road: 0.144
(6548) 08:09:25.963  d: Flagpole: 0.037
(6548) 08:09:25.963  d: Flagpole: 0.000
(6548) 08:09:26.224  d: AdvMapCreepSpawner: 0.261
(6548) 08:09:26.441  d: MemoryPool: megapool; allocated size: 94371840; payload: 93716992
(6548) 08:09:26.441  d: MemoryPool: megapool; new allocated size: 104857600
(6548) 08:09:26.591  d: AdvMapNeutralCreepSpawner: 0.366
(6548) 08:09:27.146  d: TreeObject: 0.555
(6548) 08:09:27.913  d: MultiStateObject: 0.767
(6548) 08:09:27.913  d: UsableBuilding: 0.000
(6548) 08:09:28.082  d: Building: 0.169
(6548) 08:09:28.082  d: GlyphSpawner: 0.000
(6548) 08:09:28.208  d: MemoryPool: megapool; allocated size: 104857600; payload: 104833024
(6548) 08:09:28.208  d: MemoryPool: megapool; new allocated size: 115343360
(6548) 08:09:28.234  d: Shop: 0.152
(6548) 08:09:28.293  d: MinigamePlace: 0.059
(6548) 08:09:28.299  d: Critter: 0.006
(6548) 08:09:28.407  d: Tower: 0.108
(6548) 08:09:28.410  d: AdvMapObstacle: 0.004
(6548) 08:09:28.762  d: SpawnHeroes:FindPlayers: 0.000
(6548) 08:09:28.762  d: SpawnHeroes:FindPlace: 0.000
(6548) 08:09:28.931  d: Start preloading hero's (Dummy name) resources
(6548) 08:09:28.988  d: SpawnHeroes:CreateHero:0: 0.226
(6548) 08:09:29.057  d: Start preloading hero's (Dummy name) resources
(6548) 08:09:29.076  d: SpawnHeroes:CreateHero:1: 0.088
(6548) 08:09:29.099  d: Start preloading hero's (Dummy name) resources
(6548) 08:09:29.114  d: SpawnHeroes:CreateHero:3: 0.038
(6548) 08:09:29.149  d: MemoryPool: megapool; allocated size: 115343360; payload: 115334656
(6548) 08:09:29.150  d: MemoryPool: megapool; new allocated size: 125829120
(6548) 08:09:29.188  d: Start preloading hero's (Dummy name) resources
(6548) 08:09:29.248  d: SpawnHeroes:CreateHero:4: 0.134
(6548) 08:09:29.293  d: Start preloading hero's (Dummy name) resources
(6548) 08:09:29.458  d: SpawnHeroes:CreateHero:5: 0.209
(6548) 08:09:29.594  d: Start preloading hero's (Dummy name) resources
(6548) 08:09:29.616  d: SpawnHeroes:CreateHero:2: 0.158
(6548) 08:09:29.677  d: Start preloading hero's (Dummy name) resources
(6548) 08:09:29.695  d: SpawnHeroes:CreateHero:6: 0.079
(6548) 08:09:29.756  d: Start preloading hero's (Dummy name) resources
(6548) 08:09:29.840  d: SpawnHeroes:CreateHero:7: 0.145
(6548) 08:09:29.866  d: Start preloading hero's (Dummy name) resources
(6548) 08:09:29.890  d: SpawnHeroes:CreateHero:8: 0.050
(6548) 08:09:29.891  d: Start preloading hero's (Dummy name) resources
(6548) 08:09:29.903  d: SpawnHeroes:CreateHero:9: 0.013
(6548) 08:09:29.980  d: resources[0]: Creeps/A/SuperHeavy/InventorSummon.CREEP.xdb
(6548) 08:09:30.708  d: Map StatsCoeffFromForce = 1.521
(6548) 08:09:30.714  d: Map 'Maps/Multiplayer/MOBA/_.ADMP.xdb' loaded
(12040) 08:09:30.761  d: Stopping thread. tid=6548, from_tid=12040, ptr=40bfa680
(12040) 08:09:30.761  d: Thread stopped. tid=6548, ptr=40bfa680
(12040) 08:09:31.229  d: Easel::PrefetchData: 0.435
(12040) 08:09:31.269  d: complaintsToday 2 complaintsMax 2
(12040) 08:09:31.274  d:  TRACE FROM FLASH SetHero 
(12040) 08:09:31.275  d:  TRACE FROM FLASH SetHero 
(12040) 08:09:31.289  d:  TRACE FROM FLASH SetHero 
(12040) 08:09:31.289  d:  TRACE FROM FLASH SetHero 
(12040) 08:09:31.302  d:  TRACE FROM FLASH SetHero 
(12040) 08:09:31.302  d:  TRACE FROM FLASH SetHero 
(12040) 08:09:31.315  d:  TRACE FROM FLASH SetHero 
(12040) 08:09:31.315  d:  TRACE FROM FLASH SetHero 
(12040) 08:09:31.328  d:  TRACE FROM FLASH SetHero 
(12040) 08:09:31.328  d:  TRACE FROM FLASH SetHero 
(12040) 08:09:31.343  d:  TRACE FROM FLASH SetHero 
(12040) 08:09:31.343  d:  TRACE FROM FLASH SetHero 
(12040) 08:09:31.356  d:  TRACE FROM FLASH SetHero 
(12040) 08:09:31.357  d:  TRACE FROM FLASH SetHero 
(12040) 08:09:31.369  d:  TRACE FROM FLASH SetHero 
(12040) 08:09:31.369  d:  TRACE FROM FLASH SetHero 
(12040) 08:09:31.382  d:  TRACE FROM FLASH SetHero 
(12040) 08:09:31.382  d:  TRACE FROM FLASH SetHero 
(12040) 08:09:31.396  d:  TRACE FROM FLASH SetHero 
(12040) 08:09:31.396  d:  TRACE FROM FLASH SetHero 
(12040) 08:09:31.397  d:  TRACE FROM FLASH SetHero 
(12040) 08:09:31.430  m: GameClient.MapLoadCooldown, clientId is 5599879
(12040) 08:09:31.430  m: SENDING our (5599879) progress: 100
(12040) 08:09:34.273  d: GameClient.ClientReady
(12040) 08:09:35.673  m: Frame time histo: {0; [0.0, 2.0]: 1; [2.0, 10.0]: 0; [10.0, 20.0]: 87; [20.0, 30.0]: 1; [30.0, 40.0]: 0; [40.0, 50.0]: 0; 254}
(10548) 08:09:42.753  m: RDP perfomance debug. dg_sent=304, dg_recv=300, warn=0, err=0, retr=0, loss=0.0
(10548) 08:09:42.753  m: RDP perfomance debug. polls={0; [0, 1]: 14700; [1, 2]: 0; [2, 5]: 0; [5, 10]: 0; [10, 20]: 0; [20, 50]: 0; [50, 100]: 0; [100, 200]: 0; [200, 500]: 0; 0}
(10548) 08:09:42.753  m: RDP perfomance debug. sleep={0; [0, 1]: 0; [1, 2]: 9595; [2, 5]: 5106; [5, 10]: 0; [10, 20]: 0; [20, 50]: 0; [50, 100]: 0; [100, 200]: 0; [200, 500]: 0; 0}
(7648) 08:09:43.495  m: UDP socket perfomance debug. addr=34990, recv=336, recv_tm=100.31, deliver_tm=0.00, send=312, send_tm=0.03
(12040) 08:09:44.856  m: Virtual Memory Usage: 1504 mb
(10548) 08:09:50.122  W: Datagram sequence out of range. descr=(92.242.35.6:35017 53493:100), seq=3111, wnd_start=3112, wnd_size=256
(12040) 08:09:51.174  m: gamechat::Client::OnNewMessage(sid=161280 chnlname=Session nickname=[jvc]neveron1000 msg=???????)
(12040) 08:09:54.555  m: gamechat::Client::OnNewMessage(sid=161280 chnlname=Session nickname=[jvc]neveron1000 msg=???)
(10548) 08:09:58.313  W: Datagram sequence out of range. descr=(92.242.35.6:35017 53493:100), seq=3190, wnd_start=3191, wnd_size=256
(10548) 08:10:12.754  m: RDP perfomance debug. dg_sent=395, dg_recv=395, warn=2, err=0, retr=0, loss=0.0
(10548) 08:10:12.754  m: RDP perfomance debug. polls={0; [0, 1]: 15016; [1, 2]: 0; [2, 5]: 0; [5, 10]: 0; [10, 20]: 0; [20, 50]: 0; [50, 100]: 0; [100, 200]: 0; [200, 500]: 0; 0}
(10548) 08:10:12.754  m: RDP perfomance debug. sleep={0; [0, 1]: 0; [1, 2]: 9932; [2, 5]: 5084; [5, 10]: 0; [10, 20]: 0; [20, 50]: 0; [50, 100]: 0; [100, 200]: 0; [200, 500]: 0; 0}
(12040) 08:10:13.242  m: gamechat::Client::OnNewMessage(sid=161280 chnlname=Right nickname=[jvc]neveron1000 msg=???)
(7648) 08:10:13.594  m: UDP socket perfomance debug. addr=34990, recv=397, recv_tm=99.99, deliver_tm=0.01, send=397, send_tm=0.04
(12040) 08:10:14.856  m: Virtual Memory Usage: 1504 mb
(12040) 08:10:30.016  d: GameClient.Running
(12040) 08:10:30.097  d: HideLoadingScreen
(12040) 08:10:30.102  d:  TRACE FROM FLASH Ignore -1 
(12040) 08:10:30.102  d: GameStatistics:LogPvxLogin
(12040) 08:10:30.102  d: LogPvxLogin: relayAddress = 92.242.35.3:35006
(12040) 08:10:30.102  d: Start segment step: 636 (0 commands)
(12040) 08:10:30.161  d: Movie::SetViewport (w,h) = (1821, 1027)
(12040) 08:10:34.143  m: gamechat::Client::SendMsg(msg=??? ??? chnltype=1)
(12040) 08:10:34.160  m: gamechat::Client::OnNewMessage(sid=161280 chnlname=Right nickname=[minus]???? ??????????? msg=??? ???)
(12040) 08:10:34.911  d: ServerNode: Queue lags details: {0; [0.0, 2.0]: 0; [2.0, 5.0]: 0; [5.0, 10.0]: 1; [10.0, 20.0]: 44; [20.0, 50.0]: 1; [50.0, 100.0]: 1; [100.0, 200.0]: 1; [200.0, 500.0]: 2; 0}
(12040) 08:10:34.911  d: ServerNode: Queue lags detected: min:5 average:28 max:378 count:3
(12040) 08:10:34.911  d: ServerNode: Queue lags detected: start:11:10:30 end:11:10:34 step:685 fopens:12 screenshots:0
(12040) 08:10:35.011  d: ServerNode: Lags detected: min:0 average:99 max:459 count:1
(12040) 08:10:35.011  d: ServerNode: Lags detected: start:11:10:30 end:11:10:35 step:686 fopens:12 screenshots:0
(12040) 08:10:35.011  d: ServerNode: Lags detected: RPC ping:-1 transport ping:4
(12040) 08:10:35.696  m: Frame time histo: {0; [0.0, 2.0]: 0; [2.0, 10.0]: 1; [10.0, 20.0]: 1; [20.0, 30.0]: 5; [30.0, 40.0]: 1; [40.0, 50.0]: 10; 549}
(10548) 08:10:42.755  m: RDP perfomance debug. dg_sent=535, dg_recv=535, warn=0, err=0, retr=0, loss=0.0
(10548) 08:10:42.755  m: RDP perfomance debug. polls={0; [0, 1]: 15012; [1, 2]: 0; [2, 5]: 0; [5, 10]: 0; [10, 20]: 0; [20, 50]: 0; [50, 100]: 0; [100, 200]: 0; [200, 500]: 0; 0}
(10548) 08:10:42.755  m: RDP perfomance debug. sleep={0; [0, 1]: 0; [1, 2]: 9939; [2, 5]: 5073; [5, 10]: 0; [10, 20]: 0; [20, 50]: 0; [50, 100]: 0; [100, 200]: 0; [200, 500]: 0; 0}
(7648) 08:10:43.515  m: UDP socket perfomance debug. addr=34990, recv=541, recv_tm=99.71, deliver_tm=0.01, send=542, send_tm=0.07
(12040) 08:10:44.857  m: Virtual Memory Usage: 1544 mb
(12040) 08:10:53.414  d: Nature map advance, A on Center targeted at 4
(12040) 08:10:53.414  d: Nature map state, A @ 0->0->0, B @ 0->0->0
(12040) 08:10:55.613  d: Nature map advance, B on Center targeted at 26
(12040) 08:10:55.613  d: Nature map state, A @ 48->50->50, B @ 0->0->0
(12040) 08:10:56.511  d: Segment step: 900 (1 commands)
(12040) 08:10:59.115  d: Nature map advance, A on Bottom targeted at 3
(12040) 08:10:59.115  d: Nature map state, A @ 0->0->0, B @ 0->0->0
(12040) 08:11:00.714  d: Nature map advance, A on Top targeted at 4
(12040) 08:11:00.714  d: Nature map state, A @ 0->0->0, B @ 0->0->0
(12040) 08:11:02.434  m: gamechat::Client::OnNewMessage(sid=161280 chnlname=Right nickname=[jvc]neveron1000 msg=???? ??? ???)
(12040) 08:11:04.014  d: Nature map advance, B on Top targeted at 27
(12040) 08:11:04.014  d: Nature map state, A @ 48->50->50, B @ 0->0->0
(12040) 08:11:04.015  d: Nature map advance, A on Center targeted at 10
(12040) 08:11:04.015  d: Nature map state, A @ 48->50->50, B @ 48->50->50
(12040) 08:11:06.314  d: Nature map advance, B on Center targeted at 20
(12040) 08:11:06.314  d: Nature map state, A @ 107->110->110, B @ 48->50->50
(12040) 08:11:10.314  d: Nature map advance, B on Bottom targeted at 26
(12040) 08:11:10.314  d: Nature map state, A @ 39->40->40, B @ 0->0->0
(12040) 08:11:12.214  d: Nature map advance, A on Bottom targeted at 9
(12040) 08:11:12.214  d: Nature map state, A @ 39->40->40, B @ 48->50->50
(10548) 08:11:12.756  m: RDP perfomance debug. dg_sent=709, dg_recv=709, warn=0, err=0, retr=0, loss=0.0
(10548) 08:11:12.756  m: RDP perfomance debug. polls={0; [0, 1]: 15001; [1, 2]: 0; [2, 5]: 0; [5, 10]: 0; [10, 20]: 0; [20, 50]: 0; [50, 100]: 0; [100, 200]: 0; [200, 500]: 0; 0}
(10548) 08:11:12.756  m: RDP perfomance debug. sleep={0; [0, 1]: 0; [1, 2]: 10373; [2, 5]: 4628; [5, 10]: 0; [10, 20]: 0; [20, 50]: 0; [50, 100]: 0; [100, 200]: 0; [200, 500]: 0; 0}
(12040) 08:11:12.914  d: Nature map advance, A on Top targeted at 9
(12040) 08:11:12.914  d: Nature map state, A @ 48->50->50, B @ 39->40->40
(7648) 08:11:13.521  m: UDP socket perfomance debug. addr=34990, recv=708, recv_tm=99.99, deliver_tm=0.01, send=708, send_tm=0.09
(12040) 08:11:14.215  d: Nature map advance, A on Center targeted at 15
(12040) 08:11:14.215  d: Nature map state, A @ 107->110->110, B @ 107->110->110
(12040) 08:11:14.858  m: Virtual Memory Usage: 1554 mb
(12040) 08:11:16.714  d: Nature map advance, B on Top targeted at 21
(12040) 08:11:16.714  d: Nature map state, A @ 98->100->100, B @ 39->40->40
(12040) 08:11:16.797  m: gamechat::Client::SendMsg(msg=??? ?? ??? chnltype=1)
(12040) 08:11:16.812  m: gamechat::Client::OnNewMessage(sid=161280 chnlname=Right nickname=[minus]???? ??????????? msg=??? ?? ???)
(12040) 08:11:17.780  m: gamechat::Client::SendMsg(msg=??? chnltype=1)
(12040) 08:11:17.797  m: gamechat::Client::OnNewMessage(sid=161280 chnlname=Right nickname=[minus]???? ??????????? msg=???)
(12040) 08:11:22.814  d: Nature map advance, B on Bottom targeted at 21
(12040) 08:11:22.814  d: Nature map state, A @ 97->100->100, B @ 48->50->50
(12040) 08:11:24.145  m: gamechat::Client::OnNewMessage(sid=161280 chnlname=Right nickname=[jvc]neveron1000 msg=??????? ?????? ???????)
(12040) 08:11:25.414  d: Nature map advance, A on Center targeted at 10
(12040) 08:11:25.414  d: Nature map state, A @ 158->160->160, B @ 107->110->110
(12040) 08:11:25.516  d: Nature map advance, A on Bottom targeted at 15
(12040) 08:11:25.516  d: Nature map state, A @ 97->100->100, B @ 98->100->100
(12040) 08:11:26.513  d: Segment step: 1200 (0 commands)
(12040) 08:11:30.014  d: GameClient: Ping statistics: start:11:10:30, end:11:11:30
(12040) 08:11:30.014  d: GameClient: Long ping (RPC): samples:0, min:0, max:0, avg:0
(12040) 08:11:30.014  d: GameClient: Norm ping (RPC): samples:12, min:12, max:361, avg:46
(12040) 08:11:30.015  d: GameClient: Long ping (TGS): samples:0, min:0, max:0, avg:0
(12040) 08:11:30.015  d: GameClient: Norm ping (TGS): samples:1, min:3, max:3, avg:3
(12040) 08:11:30.015  d: GameClient: Long ping (TLS): samples:0, min:0, max:0, avg:0
(12040) 08:11:30.015  d: GameClient: Norm ping (TLS): samples:5, min:1, max:4, avg:2
(12040) 08:11:30.913  m: gamechat::Client::OnNewMessage(sid=161280 chnlname=Right nickname=[N_H]????_????? msg=??)
(12040) 08:11:32.215  d: Nature map advance, B on Center targeted at 15
(12040) 08:11:32.215  d: Nature map state, A @ 112->110->110, B @ 107->110->110
(12040) 08:11:34.695  m: gamechat::Client::OnNewMessage(sid=161280 chnlname=Right nickname=[N_H]????_????? msg=?? ?? ???????)
(12040) 08:11:37.613  m: gamechat::Client::OnNewMessage(sid=161280 chnlname=Right nickname=[N_H]????_????? msg=??? ??)
(12040) 08:11:38.613  m: gamechat::Client::OnNewMessage(sid=161280 chnlname=Right nickname=[jvc]neveron1000 msg=??? ?? ? ???????? ??????)
(10548) 08:11:42.758  m: RDP perfomance debug. dg_sent=738, dg_recv=736, warn=0, err=0, retr=2, loss=0.5
(10548) 08:11:42.758  m: RDP perfomance debug. polls={0; [0, 1]: 15001; [1, 2]: 0; [2, 5]: 0; [5, 10]: 0; [10, 20]: 0; [20, 50]: 0; [50, 100]: 0; [100, 200]: 0; [200, 500]: 0; 0}
(10548) 08:11:42.758  m: RDP perfomance debug. sleep={0; [0, 1]: 0; [1, 2]: 9737; [2, 5]: 5264; [5, 10]: 0; [10, 20]: 0; [20, 50]: 0; [50, 100]: 0; [100, 200]: 0; [200, 500]: 0; 0}
(12040) 08:11:42.981  m: gamechat::Client::OnNewMessage(sid=161280 chnlname=Right nickname=[jvc]neveron1000 msg=? ???? ?????)
(7648) 08:11:43.517  m: UDP socket perfomance debug. addr=34990, recv=737, recv_tm=99.96, deliver_tm=0.01, send=739, send_tm=0.08
(12040) 08:11:44.516  d: Nature map advance, B on Top targeted at 15
(12040) 08:11:44.516  d: Nature map state, A @ 98->100->100, B @ 97->100->100
(12040) 08:11:44.860  m: Virtual Memory Usage: 1558 mb
(12040) 08:11:46.930  m: gamechat::Client::OnNewMessage(sid=161280 chnlname=Right nickname=[jvc]neveron1000 msg=???????)
(12040) 08:11:56.513  d: Segment step: 1500 (3 commands)
(10548) 08:12:12.759  m: RDP perfomance debug. dg_sent=768, dg_recv=768, warn=0, err=0, retr=0, loss=0.0
(10548) 08:12:12.759  m: RDP perfomance debug. polls={0; [0, 1]: 15001; [1, 2]: 0; [2, 5]: 0; [5, 10]: 0; [10, 20]: 0; [20, 50]: 0; [50, 100]: 0; [100, 200]: 0; [200, 500]: 0; 0}
(10548) 08:12:12.759  m: RDP perfomance debug. sleep={0; [0, 1]: 0; [1, 2]: 10174; [2, 5]: 4827; [5, 10]: 0; [10, 20]: 0; [20, 50]: 0; [50, 100]: 0; [100, 200]: 0; [200, 500]: 0; 0}
(7648) 08:12:13.519  m: UDP socket perfomance debug. addr=34990, recv=771, recv_tm=99.98, deliver_tm=0.01, send=771, send_tm=0.09
(12040) 08:12:14.860  m: Virtual Memory Usage: 1560 mb
(12040) 08:12:25.935  d: Nature map advance, A on Bottom targeted at 9
(12040) 08:12:25.935  d: Nature map state, A @ 157->160->160, B @ 98->100->100
(12040) 08:12:26.533  d: Segment step: 1800 (1 commands)
(10548) 08:12:42.760  m: RDP perfomance debug. dg_sent=760, dg_recv=760, warn=0, err=0, retr=0, loss=0.0
(10548) 08:12:42.760  m: RDP perfomance debug. polls={0; [0, 1]: 15001; [1, 2]: 0; [2, 5]: 0; [5, 10]: 0; [10, 20]: 0; [20, 50]: 0; [50, 100]: 0; [100, 200]: 0; [200, 500]: 0; 0}
(10548) 08:12:42.760  m: RDP perfomance debug. sleep={0; [0, 1]: 0; [1, 2]: 10318; [2, 5]: 4683; [5, 10]: 0; [10, 20]: 0; [20, 50]: 0; [50, 100]: 0; [100, 200]: 0; [200, 500]: 0; 0}
(7648) 08:12:43.537  m: UDP socket perfomance debug. addr=34990, recv=758, recv_tm=100.03, deliver_tm=0.01, send=758, send_tm=0.10
(12040) 08:12:44.862  m: Virtual Memory Usage: 1560 mb
(12040) 08:12:51.934  d: Nature map advance, B on Bottom targeted at 15
(12040) 08:12:51.934  d: Nature map state, A @ 103->100->100, B @ 98->100->100
(12040) 08:12:56.534  d: Segment step: 2100 (0 commands)
(10548) 08:13:12.761  m: RDP perfomance debug. dg_sent=758, dg_recv=758, warn=0, err=0, retr=0, loss=0.0
(10548) 08:13:12.761  m: RDP perfomance debug. polls={0; [0, 1]: 14999; [1, 2]: 0; [2, 5]: 0; [5, 10]: 0; [10, 20]: 0; [20, 50]: 0; [50, 100]: 0; [100, 200]: 0; [200, 500]: 0; 0}
(10548) 08:13:12.761  m: RDP perfomance debug. sleep={0; [0, 1]: 0; [1, 2]: 10184; [2, 5]: 4815; [5, 10]: 0; [10, 20]: 0; [20, 50]: 0; [50, 100]: 0; [100, 200]: 0; [200, 500]: 0; 0}
(7648) 08:13:13.541  m: UDP socket perfomance debug. addr=34990, recv=758, recv_tm=99.99, deliver_tm=0.01, send=758, send_tm=0.10
(12040) 08:13:14.863  m: Virtual Memory Usage: 1560 mb
(12040) 08:13:26.534  d: Segment step: 2400 (0 commands)
(10548) 08:13:42.761  m: RDP perfomance debug. dg_sent=770, dg_recv=770, warn=0, err=0, retr=0, loss=0.0
(10548) 08:13:42.761  m: RDP perfomance debug. polls={0; [0, 1]: 15000; [1, 2]: 0; [2, 5]: 0; [5, 10]: 0; [10, 20]: 0; [20, 50]: 0; [50, 100]: 0; [100, 200]: 0; [200, 500]: 0; 0}
(10548) 08:13:42.761  m: RDP perfomance debug. sleep={0; [0, 1]: 0; [1, 2]: 10417; [2, 5]: 4583; [5, 10]: 0; [10, 20]: 0; [20, 50]: 0; [50, 100]: 0; [100, 200]: 0; [200, 500]: 0; 0}
(7648) 08:13:43.540  m: UDP socket perfomance debug. addr=34990, recv=771, recv_tm=99.97, deliver_tm=0.01, send=771, send_tm=0.11
(12040) 08:13:44.864  m: Virtual Memory Usage: 1564 mb
(12040) 08:13:56.536  d: Segment step: 2700 (1 commands)
(12040) 08:14:01.240  d: Nature map advance, B on Bottom targeted at 21
(12040) 08:14:01.240  d: Nature map state, A @ 103->100->100, B @ 157->160->160
(12040) 08:14:05.871  m: Frame time histo: {0; [0.0, 2.0]: 0; [2.0, 10.0]: 0; [10.0, 20.0]: 1; [20.0, 30.0]: 0; [30.0, 40.0]: 9; [40.0, 50.0]: 74; 513}
(10548) 08:14:12.761  m: RDP perfomance debug. dg_sent=765, dg_recv=765, warn=0, err=0, retr=0, loss=0.0
(10548) 08:14:12.761  m: RDP perfomance debug. polls={0; [0, 1]: 14999; [1, 2]: 0; [2, 5]: 0; [5, 10]: 0; [10, 20]: 0; [20, 50]: 0; [50, 100]: 0; [100, 200]: 0; [200, 500]: 0; 0}
(10548) 08:14:12.761  m: RDP perfomance debug. sleep={0; [0, 1]: 0; [1, 2]: 10225; [2, 5]: 4774; [5, 10]: 0; [10, 20]: 0; [20, 50]: 0; [50, 100]: 0; [100, 200]: 0; [200, 500]: 0; 0}
(7648) 08:14:13.541  m: UDP socket perfomance debug. addr=34990, recv=765, recv_tm=99.98, deliver_tm=0.01, send=765, send_tm=0.10
(12040) 08:14:14.867  m: Virtual Memory Usage: 1567 mb
(12040) 08:14:17.940  d: Nature map advance, B on Top targeted at 21
(12040) 08:14:17.940  d: Nature map state, A @ 98->100->100, B @ 157->160->160
(12040) 08:14:26.440  d: Nature map advance, B on Bottom targeted at 15
(12040) 08:14:26.440  d: Nature map state, A @ 103->100->100, B @ 103->100->100
(12040) 08:14:26.537  d: Segment step: 3000 (5 commands)
(12040) 08:14:28.338  d: Nature map advance, A on Top targeted at 15
(12040) 08:14:28.338  d: Nature map state, A @ 98->100->100, B @ 103->100->100
(10548) 08:14:42.762  m: RDP perfomance debug. dg_sent=770, dg_recv=770, warn=0, err=0, retr=0, loss=0.0
(10548) 08:14:42.762  m: RDP perfomance debug. polls={0; [0, 1]: 14998; [1, 2]: 0; [2, 5]: 0; [5, 10]: 0; [10, 20]: 0; [20, 50]: 0; [50, 100]: 0; [100, 200]: 0; [200, 500]: 0; 0}
(10548) 08:14:42.762  m: RDP perfomance debug. sleep={0; [0, 1]: 0; [1, 2]: 10384; [2, 5]: 4614; [5, 10]: 0; [10, 20]: 0; [20, 50]: 0; [50, 100]: 0; [100, 200]: 0; [200, 500]: 0; 0}
(7648) 08:14:43.544  m: UDP socket perfomance debug. addr=34990, recv=769, recv_tm=99.97, deliver_tm=0.01, send=769, send_tm=0.09
(12040) 08:14:44.883  m: Virtual Memory Usage: 1570 mb
(12040) 08:14:56.555  d: Segment step: 3300 (0 commands)
(10548) 08:15:12.763  m: RDP perfomance debug. dg_sent=773, dg_recv=773, warn=0, err=0, retr=0, loss=0.0
(10548) 08:15:12.763  m: RDP perfomance debug. polls={0; [0, 1]: 14999; [1, 2]: 0; [2, 5]: 0; [5, 10]: 0; [10, 20]: 0; [20, 50]: 0; [50, 100]: 0; [100, 200]: 0; [200, 500]: 0; 0}
(10548) 08:15:12.763  m: RDP perfomance debug. sleep={0; [0, 1]: 0; [1, 2]: 10294; [2, 5]: 4705; [5, 10]: 0; [10, 20]: 0; [20, 50]: 0; [50, 100]: 0; [100, 200]: 0; [200, 500]: 0; 0}
(7648) 08:15:13.561  m: UDP socket perfomance debug. addr=34990, recv=774, recv_tm=100.02, deliver_tm=0.01, send=774, send_tm=0.11
(12040) 08:15:14.885  m: Virtual Memory Usage: 1571 mb
(12040) 08:15:26.556  d: Segment step: 3600 (2 commands)
(12040) 08:15:39.460  d: Nature map advance, B on Center targeted at 20
(12040) 08:15:39.460  d: Nature map state, A @ 112->110->110, B @ 158->160->160
(10548) 08:15:42.764  m: RDP perfomance debug. dg_sent=783, dg_recv=783, warn=0, err=0, retr=0, loss=0.0
(10548) 08:15:42.764  m: RDP perfomance debug. polls={0; [0, 1]: 15001; [1, 2]: 0; [2, 5]: 0; [5, 10]: 0; [10, 20]: 0; [20, 50]: 0; [50, 100]: 0; [100, 200]: 0; [200, 500]: 0; 0}
(10548) 08:15:42.764  m: RDP perfomance debug. sleep={0; [0, 1]: 0; [1, 2]: 10207; [2, 5]: 4794; [5, 10]: 0; [10, 20]: 0; [20, 50]: 0; [50, 100]: 0; [100, 200]: 0; [200, 500]: 0; 0}
(7648) 08:15:43.562  m: UDP socket perfomance debug. addr=34990, recv=783, recv_tm=99.98, deliver_tm=0.01, send=783, send_tm=0.11
(12040) 08:15:44.887  m: Virtual Memory Usage: 1573 mb
(12040) 08:15:51.562  d: Nature map advance, A on Center targeted at 15
(12040) 08:15:51.562  d: Nature map state, A @ 112->110->110, B @ 112->110->110
(12040) 08:15:56.547  d: Segment step: 3900 (2 commands)
(12040) 08:15:58.660  d: Nature map advance, A on Top targeted at 9
(12040) 08:15:58.660  d: Nature map state, A @ 157->160->160, B @ 103->100->100
(12040) 08:16:04.157  d: Nature map advance, B on Top targeted at 15
(12040) 08:16:04.157  d: Nature map state, A @ 103->100->100, B @ 103->100->100
(10548) 08:16:12.764  m: RDP perfomance debug. dg_sent=759, dg_recv=759, warn=0, err=0, retr=0, loss=0.0
(10548) 08:16:12.764  m: RDP perfomance debug. polls={0; [0, 1]: 14999; [1, 2]: 0; [2, 5]: 0; [5, 10]: 0; [10, 20]: 0; [20, 50]: 0; [50, 100]: 0; [100, 200]: 0; [200, 500]: 0; 0}
(10548) 08:16:12.764  m: RDP perfomance debug. sleep={0; [0, 1]: 0; [1, 2]: 10332; [2, 5]: 4667; [5, 10]: 0; [10, 20]: 0; [20, 50]: 0; [50, 100]: 0; [100, 200]: 0; [200, 500]: 0; 0}
(7648) 08:16:13.563  m: UDP socket perfomance debug. addr=34990, recv=759, recv_tm=99.98, deliver_tm=0.01, send=759, send_tm=0.10
(12040) 08:16:14.887  m: Virtual Memory Usage: 1571 mb
(12040) 08:16:26.559  d: Segment step: 4200 (3 commands)
(10548) 08:16:42.766  m: RDP perfomance debug. dg_sent=783, dg_recv=783, warn=0, err=0, retr=0, loss=0.0
(10548) 08:16:42.766  m: RDP perfomance debug. polls={0; [0, 1]: 14999; [1, 2]: 0; [2, 5]: 0; [5, 10]: 0; [10, 20]: 0; [20, 50]: 0; [50, 100]: 0; [100, 200]: 0; [200, 500]: 0; 0}
(10548) 08:16:42.766  m: RDP perfomance debug. sleep={0; [0, 1]: 0; [1, 2]: 10312; [2, 5]: 4687; [5, 10]: 0; [10, 20]: 0; [20, 50]: 0; [50, 100]: 0; [100, 200]: 0; [200, 500]: 0; 0}
(7648) 08:16:43.564  m: UDP socket perfomance debug. addr=34990, recv=782, recv_tm=99.96, deliver_tm=0.01, send=782, send_tm=0.10
(12040) 08:16:44.887  m: Virtual Memory Usage: 1572 mb
(12040) 08:16:46.326  m: gamechat::Client::OnNewMessage(sid=161280 chnlname=Right nickname=[RoAs]Gremlinnns msg=???? ?? ????? ??? ???????)
(12040) 08:16:49.944  m: gamechat::Client::SendMsg(msg=???? ??? ?? ??????? chnltype=2)
(12040) 08:16:49.959  m: gamechat::Client::OnNewMessage(sid=161280 chnlname=Session nickname=[minus]???? ??????????? msg=???? ??? ?? ???????)
(12040) 08:16:56.559  d: Segment step: 4500 (1 commands)
(12040) 08:16:57.663  d: Nature map advance, B on Bottom targeted at 21
(12040) 08:16:57.663  d: Nature map state, A @ 103->100->100, B @ 157->160->160
(12040) 08:17:03.663  d: Nature map advance, A on Bottom targeted at 15
(12040) 08:17:03.663  d: Nature map state, A @ 103->100->100, B @ 103->100->100
(10548) 08:17:12.766  m: RDP perfomance debug. dg_sent=755, dg_recv=754, warn=0, err=0, retr=0, loss=0.0
(10548) 08:17:12.766  m: RDP perfomance debug. polls={0; [0, 1]: 15000; [1, 2]: 0; [2, 5]: 0; [5, 10]: 0; [10, 20]: 0; [20, 50]: 0; [50, 100]: 0; [100, 200]: 0; [200, 500]: 0; 0}
(10548) 08:17:12.766  m: RDP perfomance debug. sleep={0; [0, 1]: 0; [1, 2]: 10246; [2, 5]: 4754; [5, 10]: 0; [10, 20]: 0; [20, 50]: 0; [50, 100]: 0; [100, 200]: 0; [200, 500]: 0; 0}
(7648) 08:17:13.565  m: UDP socket perfomance debug. addr=34990, recv=757, recv_tm=99.98, deliver_tm=0.01, send=757, send_tm=0.09
(12040) 08:17:14.889  m: Virtual Memory Usage: 1573 mb
(12040) 08:17:26.562  d: Segment step: 4800 (1 commands)
(10548) 08:17:42.766  m: RDP perfomance debug. dg_sent=774, dg_recv=774, warn=0, err=0, retr=0, loss=0.0
(10548) 08:17:42.766  m: RDP perfomance debug. polls={0; [0, 1]: 14999; [1, 2]: 0; [2, 5]: 0; [5, 10]: 0; [10, 20]: 0; [20, 50]: 0; [50, 100]: 0; [100, 200]: 0; [200, 500]: 0; 0}
(10548) 08:17:42.766  m: RDP perfomance debug. sleep={0; [0, 1]: 0; [1, 2]: 10199; [2, 5]: 4800; [5, 10]: 0; [10, 20]: 0; [20, 50]: 0; [50, 100]: 0; [100, 200]: 0; [200, 500]: 0; 0}
(7648) 08:17:43.566  m: UDP socket perfomance debug. addr=34990, recv=773, recv_tm=99.99, deliver_tm=0.01, send=773, send_tm=0.10
(12040) 08:17:44.891  m: Virtual Memory Usage: 1574 mb
(12040) 08:17:56.564  d: Segment step: 5100 (1 commands)
(12040) 08:18:08.266  d: Nature map advance, A on Bottom targeted at 9
(12040) 08:18:08.267  d: Nature map state, A @ 157->160->160, B @ 103->100->100
(10548) 08:18:12.766  m: RDP perfomance debug. dg_sent=776, dg_recv=776, warn=0, err=0, retr=0, loss=0.0
(10548) 08:18:12.766  m: RDP perfomance debug. polls={0; [0, 1]: 15000; [1, 2]: 0; [2, 5]: 0; [5, 10]: 0; [10, 20]: 0; [20, 50]: 0; [50, 100]: 0; [100, 200]: 0; [200, 500]: 0; 0}
(10548) 08:18:12.766  m: RDP perfomance debug. sleep={0; [0, 1]: 0; [1, 2]: 10337; [2, 5]: 4663; [5, 10]: 0; [10, 20]: 0; [20, 50]: 0; [50, 100]: 0; [100, 200]: 0; [200, 500]: 0; 0}
(7648) 08:18:13.568  m: UDP socket perfomance debug. addr=34990, recv=775, recv_tm=99.98, deliver_tm=0.01, send=775, send_tm=0.10
(12040) 08:18:14.893  m: Virtual Memory Usage: 1574 mb
(12040) 08:18:26.581  d: Segment step: 5400 (2 commands)
(12040) 08:18:34.682  d: Can't initiate voting before N minutes of game or less than N seconds after prevision one
(10548) 08:18:42.768  m: RDP perfomance debug. dg_sent=768, dg_recv=769, warn=0, err=0, retr=0, loss=0.0
(10548) 08:18:42.768  m: RDP perfomance debug. polls={0; [0, 1]: 15000; [1, 2]: 0; [2, 5]: 0; [5, 10]: 0; [10, 20]: 0; [20, 50]: 0; [50, 100]: 0; [100, 200]: 0; [200, 500]: 0; 0}
(10548) 08:18:42.768  m: RDP perfomance debug. sleep={0; [0, 1]: 0; [1, 2]: 10474; [2, 5]: 4526; [5, 10]: 0; [10, 20]: 0; [20, 50]: 0; [50, 100]: 0; [100, 200]: 0; [200, 500]: 0; 0}
(7648) 08:18:43.588  m: UDP socket perfomance debug. addr=34990, recv=771, recv_tm=100.03, deliver_tm=0.01, send=771, send_tm=0.10
(12040) 08:18:44.893  m: Virtual Memory Usage: 1576 mb
(12040) 08:18:46.482  d: Nature map advance, A on Center targeted at 10
(12040) 08:18:46.482  d: Nature map state, A @ 158->160->160, B @ 112->110->110
(12040) 08:18:56.582  d: Segment step: 5700 (3 commands)
(12040) 08:18:59.485  d: Nature map advance, A on Bottom targeted at 15
(12040) 08:18:59.485  d: Nature map state, A @ 103->100->100, B @ 103->100->100
(10548) 08:19:12.768  m: RDP perfomance debug. dg_sent=767, dg_recv=767, warn=0, err=0, retr=0, loss=0.0
(10548) 08:19:12.768  m: RDP perfomance debug. polls={0; [0, 1]: 15001; [1, 2]: 0; [2, 5]: 0; [5, 10]: 0; [10, 20]: 0; [20, 50]: 0; [50, 100]: 0; [100, 200]: 0; [200, 500]: 0; 0}
(10548) 08:19:12.768  m: RDP perfomance debug. sleep={0; [0, 1]: 0; [1, 2]: 10389; [2, 5]: 4612; [5, 10]: 0; [10, 20]: 0; [20, 50]: 0; [50, 100]: 0; [100, 200]: 0; [200, 500]: 0; 0}
(7648) 08:19:13.586  m: UDP socket perfomance debug. addr=34990, recv=765, recv_tm=99.98, deliver_tm=0.01, send=765, send_tm=0.10
(12040) 08:19:14.182  m: gamechat::Client::OnNewMessage(sid=161280 chnlname=Session nickname=[ELDOR]_FucK_OFF_ msg=?? ????????)
(12040) 08:19:14.894  m: Virtual Memory Usage: 1577 mb
(12040) 08:19:26.582  d: Segment step: 6000 (4 commands)
(10548) 08:19:42.769  m: RDP perfomance debug. dg_sent=760, dg_recv=760, warn=0, err=0, retr=0, loss=0.0
(10548) 08:19:42.769  m: RDP perfomance debug. polls={0; [0, 1]: 15000; [1, 2]: 0; [2, 5]: 0; [5, 10]: 0; [10, 20]: 0; [20, 50]: 0; [50, 100]: 0; [100, 200]: 0; [200, 500]: 0; 0}
(10548) 08:19:42.769  m: RDP perfomance debug. sleep={0; [0, 1]: 0; [1, 2]: 10002; [2, 5]: 4998; [5, 10]: 0; [10, 20]: 0; [20, 50]: 0; [50, 100]: 0; [100, 200]: 0; [200, 500]: 0; 0}
(7648) 08:19:43.590  m: UDP socket perfomance debug. addr=34990, recv=760, recv_tm=99.99, deliver_tm=0.01, send=760, send_tm=0.10
(12040) 08:19:44.900  m: Virtual Memory Usage: 1577 mb
(12040) 08:19:47.685  d: Nature map advance, B on Center targeted at 15
(12040) 08:19:47.685  d: Nature map state, A @ 112->110->110, B @ 112->110->110
(12040) 08:19:56.584  d: Segment step: 6300 (1 commands)
(10548) 08:20:12.769  m: RDP perfomance debug. dg_sent=750, dg_recv=750, warn=0, err=0, retr=0, loss=0.0
(10548) 08:20:12.769  m: RDP perfomance debug. polls={0; [0, 1]: 14998; [1, 2]: 1; [2, 5]: 0; [5, 10]: 0; [10, 20]: 0; [20, 50]: 0; [50, 100]: 0; [100, 200]: 0; [200, 500]: 0; 0}
(10548) 08:20:12.769  m: RDP perfomance debug. sleep={0; [0, 1]: 0; [1, 2]: 10176; [2, 5]: 4823; [5, 10]: 0; [10, 20]: 0; [20, 50]: 0; [50, 100]: 0; [100, 200]: 0; [200, 500]: 0; 0}
(7648) 08:20:13.572  m: UDP socket perfomance debug. addr=34990, recv=753, recv_tm=99.93, deliver_tm=0.01, send=752, send_tm=0.10
(12040) 08:20:14.914  m: Virtual Memory Usage: 1581 mb
(12040) 08:20:24.785  d: Can't initiate voting before N minutes of game or less than N seconds after prevision one
(12040) 08:20:26.585  d: Segment step: 6600 (0 commands)
(16492) 08:20:30.125  m: New statistics data chunk. size=2310, msg_num=29, lifetime=600.0
(16492) 08:20:30.125  m: Dispatching statistics data chunk. size=2310, msg_num=29
(16492) 08:20:30.125  m: Statistics data chunk written. size=2310, fname=C:\Users\Terem\Documents\My Games\Prime World\statdata\5bd17cce00000000a65e5c3a.sta
(12040) 08:20:31.278  d: Player [Name] has started voting
(12040) 08:20:40.189  d: Nature map advance, B on Center targeted at 20
(12040) 08:20:40.189  d: Nature map state, A @ 112->110->110, B @ 158->160->160
(10548) 08:20:42.770  m: RDP perfomance debug. dg_sent=713, dg_recv=713, warn=0, err=0, retr=0, loss=0.0
(10548) 08:20:42.770  m: RDP perfomance debug. polls={0; [0, 1]: 14998; [1, 2]: 0; [2, 5]: 0; [5, 10]: 0; [10, 20]: 0; [20, 50]: 0; [50, 100]: 0; [100, 200]: 0; [200, 500]: 0; 0}
(10548) 08:20:42.770  m: RDP perfomance debug. sleep={0; [0, 1]: 0; [1, 2]: 10176; [2, 5]: 4822; [5, 10]: 0; [10, 20]: 0; [20, 50]: 0; [50, 100]: 0; [100, 200]: 0; [200, 500]: 0; 0}
(7648) 08:20:43.583  m: UDP socket perfomance debug. addr=34990, recv=709, recv_tm=100.02, deliver_tm=0.01, send=710, send_tm=0.09
(12040) 08:20:44.915  m: Virtual Memory Usage: 1586 mb
(12040) 08:20:56.585  d: Segment step: 6900 (1 commands)
(12040) 08:21:01.186  d: Command decline surrender
(12040) 08:21:07.189  d: Nature map advance, B on Center targeted at 15
(12040) 08:21:07.189  d: Nature map state, A @ 112->110->110, B @ 112->110->110
(10548) 08:21:12.771  m: RDP perfomance debug. dg_sent=690, dg_recv=690, warn=0, err=0, retr=0, loss=0.0
(10548) 08:21:12.771  m: RDP perfomance debug. polls={0; [0, 1]: 15000; [1, 2]: 0; [2, 5]: 0; [5, 10]: 0; [10, 20]: 0; [20, 50]: 0; [50, 100]: 0; [100, 200]: 0; [200, 500]: 0; 0}
(10548) 08:21:12.771  m: RDP perfomance debug. sleep={0; [0, 1]: 0; [1, 2]: 9876; [2, 5]: 5124; [5, 10]: 0; [10, 20]: 0; [20, 50]: 0; [50, 100]: 0; [100, 200]: 0; [200, 500]: 0; 0}
(7648) 08:21:13.611  m: UDP socket perfomance debug. addr=34990, recv=691, recv_tm=100.02, deliver_tm=0.01, send=691, send_tm=0.09
(12040) 08:21:14.917  m: Virtual Memory Usage: 1591 mb
(12040) 08:21:26.588  d: Segment step: 7200 (3 commands)
(12040) 08:21:33.877  d: Nature map advance, A on Bottom targeted at 9
(12040) 08:21:33.877  d: Nature map state, A @ 157->160->160, B @ 103->100->100
(12040) 08:21:38.390  d: Nature map advance, B on Center targeted at 20
(12040) 08:21:38.390  d: Nature map state, A @ 112->110->110, B @ 158->160->160
(10548) 08:21:41.828  W: Unknown ACK. descr=(92.242.35.6:35017 53493:100), seq=12819, wnd_start=12820, buf_size=0
(10548) 08:21:42.772  m: RDP perfomance debug. dg_sent=746, dg_recv=745, warn=1, err=0, retr=2, loss=0.5
(10548) 08:21:42.772  m: RDP perfomance debug. polls={0; [0, 1]: 15000; [1, 2]: 0; [2, 5]: 0; [5, 10]: 0; [10, 20]: 0; [20, 50]: 0; [50, 100]: 0; [100, 200]: 0; [200, 500]: 0; 0}
(10548) 08:21:42.772  m: RDP perfomance debug. sleep={0; [0, 1]: 0; [1, 2]: 9943; [2, 5]: 5057; [5, 10]: 0; [10, 20]: 0; [20, 50]: 0; [50, 100]: 0; [100, 200]: 0; [200, 500]: 0; 0}
(7648) 08:21:43.610  m: UDP socket perfomance debug. addr=34990, recv=748, recv_tm=99.98, deliver_tm=0.01, send=749, send_tm=0.10
(12040) 08:21:43.992  d: Nature map advance, A on Top targeted at 4
(12040) 08:21:43.992  d: Nature map state, A @ 103->100->100, B @ 157->160->160
(12040) 08:21:44.191  d: Nature map advance, A on Center targeted at 15
(12040) 08:21:44.191  d: Nature map state, A @ 112->110->110, B @ 112->110->110
(12040) 08:21:44.923  m: Virtual Memory Usage: 1593 mb
(12040) 08:21:47.990  d: Nature map advance, A on Bottom targeted at 15
(12040) 08:21:47.990  d: Nature map state, A @ 103->100->100, B @ 103->100->100
(12040) 08:21:49.690  d: Nature map advance, B on Top targeted at 9
(12040) 08:21:49.690  d: Nature map state, A @ 52->50->50, B @ 157->160->160
(12040) 08:21:56.589  d: Segment step: 7500 (0 commands)
(10548) 08:22:12.772  m: RDP perfomance debug. dg_sent=773, dg_recv=773, warn=0, err=0, retr=0, loss=0.0
(10548) 08:22:12.772  m: RDP perfomance debug. polls={0; [0, 1]: 15001; [1, 2]: 0; [2, 5]: 0; [5, 10]: 0; [10, 20]: 0; [20, 50]: 0; [50, 100]: 0; [100, 200]: 0; [200, 500]: 0; 0}
(10548) 08:22:12.772  m: RDP perfomance debug. sleep={0; [0, 1]: 0; [1, 2]: 10403; [2, 5]: 4598; [5, 10]: 0; [10, 20]: 0; [20, 50]: 0; [50, 100]: 0; [100, 200]: 0; [200, 500]: 0; 0}
(7648) 08:22:13.610  m: UDP socket perfomance debug. addr=34990, recv=774, recv_tm=99.98, deliver_tm=0.01, send=774, send_tm=0.10
(12040) 08:22:14.391  d: Nature map advance, B on Top targeted at 15
(12040) 08:22:14.391  d: Nature map state, A @ 52->50->50, B @ 217->220->220
(12040) 08:22:14.934  m: Virtual Memory Usage: 1594 mb
(12040) 08:22:19.194  d: Nature map advance, A on Bottom targeted at 9
(12040) 08:22:19.194  d: Nature map state, A @ 157->160->160, B @ 103->100->100
(12040) 08:22:24.691  d: Nature map advance, B on Top targeted at 9
(12040) 08:22:24.691  d: Nature map state, A @ 52->50->50, B @ 163->160->160
(12040) 08:22:26.590  d: Segment step: 7800 (2 commands)
(12040) 08:22:38.294  d: Nature map advance, A on Center targeted at 10
(12040) 08:22:38.294  d: Nature map state, A @ 158->160->160, B @ 112->110->110
(10548) 08:22:42.774  m: RDP perfomance debug. dg_sent=766, dg_recv=766, warn=0, err=0, retr=0, loss=0.0
(10548) 08:22:42.774  m: RDP perfomance debug. polls={0; [0, 1]: 14999; [1, 2]: 0; [2, 5]: 0; [5, 10]: 0; [10, 20]: 0; [20, 50]: 0; [50, 100]: 0; [100, 200]: 0; [200, 500]: 0; 0}
(10548) 08:22:42.774  m: RDP perfomance debug. sleep={0; [0, 1]: 0; [1, 2]: 10199; [2, 5]: 4800; [5, 10]: 0; [10, 20]: 0; [20, 50]: 0; [50, 100]: 0; [100, 200]: 0; [200, 500]: 0; 0}
(7648) 08:22:43.616  m: UDP socket perfomance debug. addr=34990, recv=766, recv_tm=99.99, deliver_tm=0.01, send=767, send_tm=0.10
(12040) 08:22:44.936  m: Virtual Memory Usage: 1597 mb
(12040) 08:22:56.608  d: Segment step: 8100 (3 commands)
(10548) 08:23:12.775  m: RDP perfomance debug. dg_sent=763, dg_recv=763, warn=0, err=0, retr=0, loss=0.0
(10548) 08:23:12.775  m: RDP perfomance debug. polls={0; [0, 1]: 15001; [1, 2]: 0; [2, 5]: 0; [5, 10]: 0; [10, 20]: 0; [20, 50]: 0; [50, 100]: 0; [100, 200]: 0; [200, 500]: 0; 0}
(10548) 08:23:12.775  m: RDP perfomance debug. sleep={0; [0, 1]: 0; [1, 2]: 10102; [2, 5]: 4899; [5, 10]: 0; [10, 20]: 0; [20, 50]: 0; [50, 100]: 0; [100, 200]: 0; [200, 500]: 0; 0}
(12040) 08:23:13.512  d: Nature map advance, A on Center targeted at 15
(12040) 08:23:13.512  d: Nature map state, A @ 112->110->110, B @ 112->110->110
(7648) 08:23:13.615  m: UDP socket perfomance debug. addr=34990, recv=761, recv_tm=99.98, deliver_tm=0.01, send=760, send_tm=0.11
(12040) 08:23:14.937  m: Virtual Memory Usage: 1602 mb
(12040) 08:23:26.609  d: Segment step: 8400 (2 commands)
(12040) 08:23:34.611  d: Nature map advance, B on Bottom targeted at 15
(12040) 08:23:34.611  d: Nature map state, A @ 103->100->100, B @ 103->100->100
(10548) 08:23:42.777  m: RDP perfomance debug. dg_sent=730, dg_recv=730, warn=0, err=0, retr=0, loss=0.0
(10548) 08:23:42.777  m: RDP perfomance debug. polls={0; [0, 1]: 15001; [1, 2]: 0; [2, 5]: 0; [5, 10]: 0; [10, 20]: 0; [20, 50]: 0; [50, 100]: 0; [100, 200]: 0; [200, 500]: 0; 0}
(10548) 08:23:42.777  m: RDP perfomance debug. sleep={0; [0, 1]: 0; [1, 2]: 10305; [2, 5]: 4696; [5, 10]: 0; [10, 20]: 0; [20, 50]: 0; [50, 100]: 0; [100, 200]: 0; [200, 500]: 0; 0}
(7648) 08:23:43.617  m: UDP socket perfomance debug. addr=34990, recv=731, recv_tm=99.98, deliver_tm=0.01, send=731, send_tm=0.10
(12040) 08:23:44.940  m: Virtual Memory Usage: 1605 mb
(12040) 08:23:47.315  d: Nature map advance, A on Bottom targeted at 3
(12040) 08:23:47.315  d: Nature map state, A @ 103->100->100, B @ 157->160->160
(12040) 08:23:52.811  d: Nature map advance, B on Bottom targeted at 9
(12040) 08:23:52.811  d: Nature map state, A @ 43->40->40, B @ 157->160->160
(12040) 08:23:56.611  d: Segment step: 8700 (1 commands)
(10548) 08:24:12.777  m: RDP perfomance debug. dg_sent=753, dg_recv=753, warn=0, err=0, retr=0, loss=0.0
(10548) 08:24:12.777  m: RDP perfomance debug. polls={0; [0, 1]: 15000; [1, 2]: 0; [2, 5]: 0; [5, 10]: 0; [10, 20]: 0; [20, 50]: 0; [50, 100]: 0; [100, 200]: 0; [200, 500]: 0; 0}
(10548) 08:24:12.777  m: RDP perfomance debug. sleep={0; [0, 1]: 0; [1, 2]: 10275; [2, 5]: 4725; [5, 10]: 0; [10, 20]: 0; [20, 50]: 0; [50, 100]: 0; [100, 200]: 0; [200, 500]: 0; 0}
(7648) 08:24:13.617  m: UDP socket perfomance debug. addr=34990, recv=752, recv_tm=99.99, deliver_tm=0.01, send=752, send_tm=0.10
(12040) 08:24:14.956  m: Virtual Memory Usage: 1604 mb
(10548) 08:24:24.938  W: Unknown ACK. descr=(92.242.35.6:35017 53493:100), seq=15205, wnd_start=15206, buf_size=0
(12040) 08:24:26.611  d: Segment step: 9000 (2 commands)
(12040) 08:24:31.516  d: Nature map advance, B on Bottom targeted at 15
(12040) 08:24:31.516  d: Nature map state, A @ 43->40->40, B @ 217->220->220
(12040) 08:24:38.346  m: gamechat::Client::OnNewMessage(sid=161280 chnlname=Session nickname=[ELDOR]_FucK_OFF_ msg=? ??? ??? ??????)
(12040) 08:24:40.462  m: gamechat::Client::OnNewMessage(sid=161280 chnlname=Session nickname=[ELDOR]_FucK_OFF_ msg=???)
(10548) 08:24:42.777  m: RDP perfomance debug. dg_sent=733, dg_recv=733, warn=1, err=0, retr=1, loss=0.2
(10548) 08:24:42.777  m: RDP perfomance debug. polls={0; [0, 1]: 15000; [1, 2]: 0; [2, 5]: 0; [5, 10]: 0; [10, 20]: 0; [20, 50]: 0; [50, 100]: 0; [100, 200]: 0; [200, 500]: 0; 0}
(10548) 08:24:42.777  m: RDP perfomance debug. sleep={0; [0, 1]: 0; [1, 2]: 10126; [2, 5]: 4874; [5, 10]: 0; [10, 20]: 0; [20, 50]: 0; [50, 100]: 0; [100, 200]: 0; [200, 500]: 0; 0}
(7648) 08:24:43.617  m: UDP socket perfomance debug. addr=34990, recv=733, recv_tm=99.98, deliver_tm=0.01, send=734, send_tm=0.09
(12040) 08:24:44.957  m: Virtual Memory Usage: 1605 mb
(12040) 08:24:46.396  m: Frame time histo: {0; [0.0, 2.0]: 0; [2.0, 10.0]: 0; [10.0, 20.0]: 1; [20.0, 30.0]: 0; [30.0, 40.0]: 1; [40.0, 50.0]: 91; 505}
(10548) 08:24:51.321  W: Datagram sequence out of range. descr=(92.242.35.6:35017 53493:100), seq=12293, wnd_start=12294, wnd_size=256
(12040) 08:24:56.615  d: Segment step: 9300 (2 commands)
(10548) 08:25:12.778  m: RDP perfomance debug. dg_sent=776, dg_recv=776, warn=1, err=0, retr=0, loss=0.0
(10548) 08:25:12.778  m: RDP perfomance debug. polls={0; [0, 1]: 15000; [1, 2]: 0; [2, 5]: 0; [5, 10]: 0; [10, 20]: 0; [20, 50]: 0; [50, 100]: 0; [100, 200]: 0; [200, 500]: 0; 0}
(10548) 08:25:12.778  m: RDP perfomance debug. sleep={0; [0, 1]: 0; [1, 2]: 10103; [2, 5]: 4897; [5, 10]: 0; [10, 20]: 0; [20, 50]: 0; [50, 100]: 0; [100, 200]: 0; [200, 500]: 0; 0}
(7648) 08:25:13.620  m: UDP socket perfomance debug. addr=34990, recv=776, recv_tm=99.98, deliver_tm=0.01, send=775, send_tm=0.09
(12040) 08:25:14.959  m: Virtual Memory Usage: 1605 mb
(12040) 08:25:26.616  d: Segment step: 9600 (1 commands)
(10548) 08:25:42.779  m: RDP perfomance debug. dg_sent=752, dg_recv=752, warn=0, err=0, retr=0, loss=0.0
(10548) 08:25:42.779  m: RDP perfomance debug. polls={0; [0, 1]: 15001; [1, 2]: 0; [2, 5]: 0; [5, 10]: 0; [10, 20]: 0; [20, 50]: 0; [50, 100]: 0; [100, 200]: 0; [200, 500]: 0; 0}
(10548) 08:25:42.779  m: RDP perfomance debug. sleep={0; [0, 1]: 0; [1, 2]: 9879; [2, 5]: 5122; [5, 10]: 0; [10, 20]: 0; [20, 50]: 0; [50, 100]: 0; [100, 200]: 0; [200, 500]: 0; 0}
(7648) 08:25:43.621  m: UDP socket perfomance debug. addr=34990, recv=751, recv_tm=99.98, deliver_tm=0.01, send=751, send_tm=0.09
(12040) 08:25:44.960  m: Virtual Memory Usage: 1604 mb
(12040) 08:25:56.618  d: Segment step: 9900 (3 commands)
(12040) 08:26:02.318  d: Nature map advance, A on Bottom targeted at 9
(12040) 08:26:02.318  d: Nature map state, A @ 43->40->40, B @ 163->160->160
(12040) 08:26:11.833  d: Player [Name] has started voting
(12040) 08:26:12.235  d: Player [Name] has started voting
(10548) 08:26:12.781  m: RDP perfomance debug. dg_sent=791, dg_recv=791, warn=0, err=0, retr=0, loss=0.0
(10548) 08:26:12.781  m: RDP perfomance debug. polls={0; [0, 1]: 15001; [1, 2]: 0; [2, 5]: 0; [5, 10]: 0; [10, 20]: 0; [20, 50]: 0; [50, 100]: 0; [100, 200]: 0; [200, 500]: 0; 0}
(10548) 08:26:12.781  m: RDP perfomance debug. sleep={0; [0, 1]: 0; [1, 2]: 10241; [2, 5]: 4760; [5, 10]: 0; [10, 20]: 0; [20, 50]: 0; [50, 100]: 0; [100, 200]: 0; [200, 500]: 0; 0}
(7648) 08:26:13.640  m: UDP socket perfomance debug. addr=34990, recv=790, recv_tm=100.03, deliver_tm=0.01, send=790, send_tm=0.10
(11076) 08:26:14.137  d: Command decline surrender
(12040) 08:26:14.964  m: Virtual Memory Usage: 1607 mb
(12040) 08:26:21.917  m: gamechat::Client::OnNewMessage(sid=161280 chnlname=Session nickname=[ELDOR]_FucK_OFF_ msg=?????? ?? ???????)
(12040) 08:26:22.837  d: Nature map advance, B on Bottom targeted at 21
(12040) 08:26:22.837  d: Nature map state, A @ 97->100->100, B @ 163->160->160
(12040) 08:26:26.634  d: Segment step: 10200 (2 commands)
(12040) 08:26:31.869  d: Pump messages lag
(12040) 08:26:31.869  d: ServerNode: Queue lags details: {0; [0.0, 2.0]: 0; [2.0, 5.0]: 0; [5.0, 10.0]: 1; [10.0, 20.0]: 37; [20.0, 50.0]: 0; [50.0, 100.0]: 0; [100.0, 200.0]: 0; [200.0, 500.0]: 0; 12}
(12040) 08:26:31.869  d: ServerNode: Queue lags detected: min:8 average:583 max:2945 count:12
(12040) 08:26:31.869  d: ServerNode: Queue lags detected: start:11:26:25 end:11:26:31 step:10235 fopens:0 screenshots:0
(12040) 08:26:31.869  d: ServerNode: Lags detected: min:0 average:134 max:3035 count:1
(12040) 08:26:31.869  d: ServerNode: Lags detected: start:11:26:25 end:11:26:31 step:10236 fopens:0 screenshots:0
(12040) 08:26:31.869  d: ServerNode: Lags detected: RPC ping:15 transport ping:5
(12040) 08:26:31.874  d: GameClient: Ping statistics: start:11:25:30, end:11:26:31
(12040) 08:26:31.874  d: GameClient: Long ping (RPC): samples:0, min:0, max:0, avg:0
(12040) 08:26:31.874  d: GameClient: Norm ping (RPC): samples:12, min:14, max:17, avg:15
(12040) 08:26:31.874  d: GameClient: Long ping (TGS): samples:0, min:0, max:0, avg:0
(12040) 08:26:31.874  d: GameClient: Norm ping (TGS): samples:0, min:0, max:0, avg:0
(12040) 08:26:31.874  d: GameClient: Long ping (TLS): samples:0, min:0, max:0, avg:0
(12040) 08:26:31.875  d: GameClient: Norm ping (TLS): samples:5, min:1, max:3, avg:2
(12040) 08:26:31.875  d: Re-acquiring input device 'Мышь'...
(12040) 08:26:31.875  d: Re-acquiring input device 'Клавиатура'...
(12040) 08:26:31.883  d: NotifyDeviceLost
(12040) 08:26:31.885  d: AltTabChecker: lost focus
(12040) 08:26:31.918  d: Nature map advance, A on Bottom targeted at 15
(12040) 08:26:31.918  d: Nature map state, A @ 97->100->100, B @ 103->100->100
(12040) 08:26:34.527  d: Nature map advance, A on Center targeted at 10
(12040) 08:26:34.527  d: Nature map state, A @ 158->160->160, B @ 112->110->110
(12040) 08:26:35.027  d: ServerNode: Queue lags details: {0; [0.0, 2.0]: 24; [2.0, 5.0]: 7; [5.0, 10.0]: 1; [10.0, 20.0]: 0; [20.0, 50.0]: 1; [50.0, 100.0]: 0; [100.0, 200.0]: 1; [200.0, 500.0]: 3; 13}
(12040) 08:26:35.028  d: ServerNode: Queue lags detected: min:0 average:323 max:1746 count:17
(12040) 08:26:35.028  d: ServerNode: Queue lags detected: start:11:26:31 end:11:26:35 step:10285 fopens:0 screenshots:0
(10548) 08:26:36.634  W: Datagram sequence out of range. descr=(92.242.35.6:35017 53493:100), seq=13366, wnd_start=13367, wnd_size=256
(10548) 08:26:36.634  W: Datagram sequence out of range. descr=(92.242.35.6:35017 53493:100), seq=13366, wnd_start=13367, wnd_size=256
(12040) 08:26:36.678  m: Frame time histo: {0; [0.0, 2.0]: 1; [2.0, 10.0]: 1; [10.0, 20.0]: 0; [20.0, 30.0]: 0; [30.0, 40.0]: 1; [40.0, 50.0]: 20; 1833}
(11076) 08:26:37.031  d: Command decline surrender
(10548) 08:26:38.800  W: Datagram sequence out of range. descr=(92.242.35.6:35017 53493:100), seq=13377, wnd_start=13378, wnd_size=256
(10548) 08:26:38.800  W: Datagram sequence out of range. descr=(92.242.35.6:35017 53493:100), seq=13377, wnd_start=13378, wnd_size=256
(10548) 08:26:38.800  W: Datagram sequence out of range. descr=(92.242.35.6:35017 53493:100), seq=13377, wnd_start=13379, wnd_size=256
(10548) 08:26:38.800  W: Datagram sequence out of range. descr=(92.242.35.6:35017 53493:100), seq=13378, wnd_start=13380, wnd_size=256
(10548) 08:26:38.800  W: Datagram sequence out of range. descr=(92.242.35.6:35017 53493:100), seq=13377, wnd_start=13382, wnd_size=256
(10548) 08:26:38.800  W: Datagram sequence out of range. descr=(92.242.35.6:35017 53493:100), seq=13379, wnd_start=13386, wnd_size=256
(10548) 08:26:38.806  W: Unknown ACK. descr=(92.242.35.6:35017 53493:100), seq=17135, wnd_start=17136, buf_size=0
